{
  "$schema": "https://json-schema.org/draft/2020-12/schema",
  "$id": "https://gilmore.games/schemas/game-manifest.schema.json",
  "title": "Gilmore Games manifest",
  "type": "object",
  "additionalProperties": false,
  "required": [
    "id",
    "title",
    "description",
    "slug",
    "origin",
    "canonicalUrl",
    "repository",
    "framework",
    "status"
  ],
  "properties": {
    "id": { "type": "string", "pattern": "^[a-z0-9]+(?:-[a-z0-9]+)*$" },
    "title": { "type": "string", "minLength": 1 },
    "description": { "type": "string", "minLength": 1 },
    "slug": { "type": "string", "pattern": "^[a-z0-9]+(?:-[a-z0-9]+)*$" },
    "origin": { "type": "string", "format": "uri", "pattern": "^https://" },
    "canonicalUrl": { "type": "string", "format": "uri", "pattern": "^https://gilmore\\.games/" },
    "repository": { "type": "string", "format": "uri", "pattern": "^https://github\\.com/" },
    "framework": {
      "type": "string",
      "enum": ["plain-html", "vite", "react", "phaser", "nextjs", "other"]
    },
    "genre": { "type": "string" },
    "players": { "type": "string" },
    "status": {
      "type": "string",
      "enum": ["planned", "testing", "live", "retired"]
    }
  }
}
